{
  "$schema": "https://json-schema.org/draft/2020-12/schema",
  "$id": "https://aetherius.dev/contracts/blueprint.schema.json",
  "title": "Aetherius Blueprint",
  "description": "The declarative instruction file executed by Aetherius. Language-agnostic source of truth shared by the Python core and every SDK.",
  "type": "object",
  "required": ["aetherius", "name", "act"],
  "additionalProperties": false,
  "properties": {
    "aetherius": {
      "type": "string",
      "description": "Blueprint format version.",
      "pattern": "^[0-9]+\\.[0-9]+$"
    },
    "name": {
      "type": "string",
      "description": "Dotted identifier, e.g. domain.task.",
      "minLength": 1
    },
    "description": { "type": "string" },
    "act": {
      "description": "Execution engine.",
      "enum": ["vector", "continuum", "oracle", "phantom"]
    },
    "inputs": {
      "type": "object",
      "description": "Declared, typed parameters that make the Blueprint reusable.",
      "additionalProperties": { "$ref": "#/$defs/inputSpec" }
    },
    "secrets": {
      "type": "array",
      "description": "Names of runtime-only secrets. Values are injected at execution and never stored in the file.",
      "items": { "type": "string" },
      "uniqueItems": true
    },
    "vars": {
      "type": "object",
      "description": "Local constants (domains, paths) available for interpolation."
    },
    "options": { "$ref": "#/$defs/options" },
    "vision": {
      "type": "object",
      "description": "Cognition configuration for Oracle/Phantom (see docs/cognition.md).",
      "properties": {
        "provider": {
          "enum": ["claude", "local"],
          "description": "Cognition backend: claude (default, [cognition] extra) or local ([vision] extra, on-device grounder)."
        },
        "model": {
          "type": "string",
          "description": "Model name, not backend: an Anthropic model id for claude, a local asset name@version for local."
        }
      },
      "additionalProperties": true
    },
    "goal": {
      "type": "string",
      "description": "High-level objective for Phantom (Act IV) when the run is not fully scripted."
    },
    "constraints": {
      "type": "array",
      "description": "Guardrails for Phantom.",
      "items": { "type": "string" }
    },
    "steps": {
      "type": "array",
      "description": "The ordered action sequence (the action dictionary).",
      "items": { "$ref": "#/$defs/step" }
    },
    "outputs": {
      "type": "object",
      "description": "Shape of the returned data, via interpolation of step results."
    }
  },
  "anyOf": [
    { "required": ["steps"] },
    { "required": ["goal"] }
  ],
  "$defs": {
    "inputSpec": {
      "type": "object",
      "additionalProperties": false,
      "required": ["type"],
      "properties": {
        "type": { "enum": ["string", "number", "integer", "boolean", "date", "path", "object", "array"] },
        "required": { "type": "boolean", "default": false },
        "format": { "type": "string" },
        "default": {},
        "description": { "type": "string" }
      }
    },
    "options": {
      "type": "object",
      "additionalProperties": false,
      "properties": {
        "debug": {
          "type": "boolean",
          "default": false,
          "description": "Visible browser + cursor overlay + slow-mo for browser Acts; structured terminal logs otherwise."
        },
        "stealth": { "$ref": "#/$defs/stealth" },
        "session": {
          "type": "object",
          "additionalProperties": false,
          "properties": {
            "profile": { "type": "string" },
            "persist": { "type": "boolean", "default": false }
          }
        },
        "timeout_ms": { "type": "integer", "minimum": 0 },
        "retries": {
          "type": "object",
          "additionalProperties": false,
          "properties": {
            "max": { "type": "integer", "minimum": 0 },
            "backoff": { "enum": ["none", "linear", "exponential"] }
          }
        },
        "proxy": { "$ref": "#/$defs/proxy" },
        "agent": {
          "type": "object",
          "additionalProperties": false,
          "description": "Phantom (Act IV) guardrails; ignored by the other Acts.",
          "properties": {
            "max_steps": {
              "type": "integer",
              "minimum": 1,
              "default": 40,
              "description": "Upper bound on the perceive->reason->act loop: the agent fails cleanly if the goal is not reached within this many steps."
            }
          }
        },
        "fallback": {
          "type": "array",
          "description": "Self-healing (Jalon 2-D): default escalation chain tried, in order, when a browser step fails and carries a 'describe' (or a vision target). A step's own 'fallback' overrides it.",
          "items": { "enum": ["oracle", "phantom"] }
        }
      }
    },
    "proxy": {
      "description": "Network identity (Jalon G). Routes both engines through a proxy, rotates the exit IP, prevents the WebRTC leak, and keeps the fingerprint's geography coherent. Credentials are never stored: pass them via {{ secrets.x }}.",
      "oneOf": [
        { "type": "string", "description": "A proxy URL (scheme://[user:pass@]host:port) or a {{ secrets.x }} that renders one." },
        {
          "type": "object",
          "additionalProperties": false,
          "properties": {
            "url": { "type": "string", "description": "A single proxy (or rotating gateway) URL." },
            "pool": {
              "type": "array",
              "description": "Proxy URLs to rotate over.",
              "items": { "type": "string" },
              "minItems": 1
            },
            "rotate": {
              "enum": ["per_run", "round_robin", "random", "sticky"],
              "description": "Rotation strategy across runs. Default per_run."
            },
            "geo": { "type": "string", "description": "Exit-IP country (ISO 3166-1 alpha-2, e.g. FR) to align timezone/locale/languages with." },
            "impersonate": {
              "description": "TLS impersonation target for Vector (JA3/JA4), e.g. \"chrome\"; true means chrome. Requires the [network] extra.",
              "oneOf": [{ "type": "string" }, { "type": "boolean" }]
            }
          }
        }
      ]
    },
    "stealth": {
      "description": "Modular discretion. Off by default; a preset name; or an inline configuration.",
      "oneOf": [
        { "type": "string", "description": "\"off\" or a named preset." },
        {
          "type": "object",
          "additionalProperties": false,
          "properties": {
            "mouse": { "enum": ["off", "gestures"] },
            "keyboard": { "enum": ["off", "human"] },
            "scroll": { "enum": ["off", "eased"] },
            "timing": {
              "type": "object",
              "additionalProperties": false,
              "properties": { "distraction": { "type": "number", "minimum": 0, "maximum": 1 } }
            },
            "fingerprint": { "type": "string" },
            "user_agent": {
              "type": "string",
              "description": "Browser Acts only: the User-Agent string to wear, overriding the fingerprint profile's. The one piece of discretion the embedded engine honours too, because a portal often serves a different DOM to a mobile UA."
            }
          }
        }
      ]
    },
    "step": {
      "type": "object",
      "description": "A single action. Parameters depend on the action; extra properties are allowed and validated per-action by the engine. Act III+ adds 'read' (semantic extraction: 'vision' description plus optional 'schema' object shaping the reply).",
      "properties": {
        "id": { "type": "string" },
        "action": { "type": "string" },
        "when": {
          "type": "string",
          "description": "Guard expression rendered before dispatch; the step is skipped unless it yields true/1/yes."
        },
        "act": {
          "enum": ["vector", "continuum", "oracle", "phantom"],
          "description": "Multi-Act composition (Jalon 2-D): overrides the Blueprint act for this step (nested flow steps inherit it). Browser Acts share a single browser within the run."
        },
        "describe": {
          "type": "string",
          "description": "Self-healing: natural-language intent of the step, replayed on a higher Act (vision grounding or agent micro-goal) when its selector fails. Without it a failing selector step is not escalated."
        },
        "fallback": {
          "type": "array",
          "description": "Self-healing: per-step escalation chain; overrides options.fallback ([] disables it for this step).",
          "items": { "enum": ["oracle", "phantom"] }
        },
        "target": {
          "description": "Unified target of an interactive action. Either the drop selector of drag (string), or an object aiming at a DOM selector ({selector, selector_type}) or, on Act III+, at a natural-language description resolved by vision grounding ({vision}). Top-level 'selector' and 'target' are mutually exclusive on a step.",
          "oneOf": [
            { "type": "string", "description": "drag only: selector to drop onto." },
            {
              "type": "object",
              "properties": {
                "vision": { "type": "string", "description": "Natural-language description of the on-screen element (Act III+)." },
                "selector": { "type": "string", "description": "DOM selector (nested form of the top-level 'selector')." },
                "selector_type": { "enum": ["css", "xpath", "text"] }
              },
              "additionalProperties": true
            }
          ]
        },
        "then": {
          "type": "array",
          "description": "Steps run when an if condition holds.",
          "items": { "$ref": "#/$defs/step" }
        },
        "else": {
          "type": "array",
          "description": "Steps run when an if condition does not hold.",
          "items": { "$ref": "#/$defs/step" }
        },
        "steps": {
          "type": "array",
          "description": "Nested steps for repeat and for_each.",
          "items": { "$ref": "#/$defs/step" }
        }
      },
      "required": ["action"],
      "additionalProperties": true
    }
  }
}
